{
  "schema_version": "codex-candidate-test-fact-map/v1",
  "codex_version": "0.154.0",
  "fact_prefix": "CANDIDATE_TRACE_FACT ",
  "forbidden_record_types": [
    "http_request",
    "tls_client_hello",
    "websocket_frame"
  ],
  "tests": [
    {
      "package": "github.com/Wei-Shaw/sub2api/internal/service",
      "name": "TestCandidateTraceCodex0145RuntimeAndBoundaryFacts",
      "test_file": "backend/internal/service/official_egress_codex_candidate_trace_acceptance_test.go",
      "test_file_sha256": "9a155f84634652927c879eac53b0abf6919d515a48653125410daa43e9e323eb",
      "source_files": [
        {
          "path": "backend/internal/service/official_egress_codex_0145_profile.go",
          "sha256": "02ec8fcbb8a567b3c6adb0861bfe4bb7d1803362325d531b1e2b47f3430c8377"
        },
        {
          "path": "backend/internal/service/official_egress_codex_engine.go",
          "sha256": "78269f6fe5ff4154421402337b5e33efdec720ba6172b9d75794747ece70846c"
        },
        {
          "path": "backend/internal/service/official_egress_codex_integration.go",
          "sha256": "ddfcbad5951d1292388fc604a7bb3c8a66b410d3f80044d8d708d45a87a8f8a8"
        }
      ],
      "facts": [
        {
          "fact_id": "a04.conditional-subagent",
          "scenario_id": "A04",
          "record_type": "conditional_header",
          "trace_kind": "process_trace",
          "data_keys": [
            "name",
            "value"
          ],
          "required_source_kinds": [
            "relay_binary"
          ]
        },
        {
          "fact_id": "a04.conditional-memgen",
          "scenario_id": "A04",
          "record_type": "conditional_header",
          "trace_kind": "process_trace",
          "data_keys": [
            "name",
            "value"
          ],
          "required_source_kinds": [
            "relay_binary"
          ]
        },
        {
          "fact_id": "a04.conditional-parent-thread",
          "scenario_id": "A04",
          "record_type": "conditional_header",
          "trace_kind": "process_trace",
          "data_keys": [
            "name",
            "value_sha256"
          ],
          "required_source_kinds": [
            "relay_binary"
          ]
        },
        {
          "fact_id": "a04.conditional-timing-metrics",
          "scenario_id": "A04",
          "record_type": "conditional_header",
          "trace_kind": "process_trace",
          "data_keys": [
            "name",
            "value"
          ],
          "required_source_kinds": [
            "relay_binary"
          ]
        },
        {
          "fact_id": "a04.serialization-boundary",
          "scenario_id": "A04",
          "record_type": "serialization_boundary",
          "trace_kind": "process_trace",
          "data_keys": [
            "egress_occurrences",
            "ingress_sentinel"
          ],
          "required_source_kinds": [
            "relay_binary"
          ]
        },
        {
          "fact_id": "a09.image-tool-nonlite",
          "scenario_id": "A09",
          "record_type": "image_tool_flow",
          "trace_kind": "process_trace",
          "data_keys": [
            "hosted_image_generation_occurrences",
            "mode",
            "namespace",
            "tool"
          ],
          "required_source_kinds": [
            "relay_binary"
          ]
        },
        {
          "fact_id": "a09.image-tool-lite",
          "scenario_id": "A09",
          "record_type": "image_tool_flow",
          "trace_kind": "process_trace",
          "data_keys": [
            "location",
            "mode"
          ],
          "required_source_kinds": [
            "relay_binary"
          ]
        },
        {
          "fact_id": "a09.image-edit-encoding",
          "scenario_id": "A09",
          "record_type": "image_edit_encoding",
          "trace_kind": "process_trace",
          "data_keys": [
            "content_type",
            "images_scheme",
            "multipart_part_count"
          ],
          "required_source_kinds": [
            "relay_binary"
          ]
        }
      ]
    },
    {
      "package": "github.com/Wei-Shaw/sub2api/internal/service",
      "name": "TestCandidateTraceCodex0145LiteAndPrefixFacts",
      "test_file": "backend/internal/service/official_egress_codex_candidate_trace_acceptance_test.go",
      "test_file_sha256": "9a155f84634652927c879eac53b0abf6919d515a48653125410daa43e9e323eb",
      "source_files": [
        {
          "path": "backend/internal/service/official_egress_openai_http.go",
          "sha256": "38e21b8c9ad427ef24efc61f35950fc9d92e53bb94bc19e01648f9ea3b0cad76"
        },
        {
          "path": "backend/internal/service/openai_ws_forwarder_payload.go",
          "sha256": "9efae6cb124186e47aa0534048248fcab540638009d2c055053e1994d5fa723f"
        }
      ],
      "facts": [
        {
          "fact_id": "a03.lite-transform",
          "scenario_id": "A03",
          "record_type": "lite_transform",
          "trace_kind": "process_trace",
          "data_keys": [
            "additional_tools_occurrences",
            "instructions_location",
            "parallel_tool_calls",
            "reasoning_context",
            "tools_location",
            "transport"
          ],
          "required_source_kinds": [
            "relay_binary"
          ]
        },
        {
          "fact_id": "a06.prefix-reuse",
          "scenario_id": "A06",
          "record_type": "response_prefix_reuse",
          "trace_kind": "websocket_trace",
          "data_keys": [
            "prefix_reusable",
            "previous_response_id_presence"
          ],
          "required_source_kinds": [
            "relay_binary"
          ]
        }
      ]
    },
    {
      "package": "github.com/Wei-Shaw/sub2api/internal/service",
      "name": "TestCandidateTraceCodex0145TurnStateFacts",
      "test_file": "backend/internal/service/official_egress_codex_candidate_trace_acceptance_test.go",
      "test_file_sha256": "9a155f84634652927c879eac53b0abf6919d515a48653125410daa43e9e323eb",
      "source_files": [
        {
          "path": "backend/internal/service/official_egress_openai_http.go",
          "sha256": "38e21b8c9ad427ef24efc61f35950fc9d92e53bb94bc19e01648f9ea3b0cad76"
        },
        {
          "path": "backend/internal/service/official_egress_openai_ws.go",
          "sha256": "9ab49b7bf5c9311f817435af0fcabfeac76d508abbe38f44c7d1d06f18e0b48d"
        }
      ],
      "facts": [
        {
          "fact_id": "a03.turn-state-http",
          "scenario_id": "A03",
          "record_type": "turn_state_chain",
          "trace_kind": "process_trace",
          "data_keys": [
            "received_sha256",
            "return_channel",
            "returned_sha256"
          ],
          "required_source_kinds": [
            "relay_binary"
          ]
        },
        {
          "fact_id": "a05.turn-state-ws",
          "scenario_id": "A05",
          "record_type": "turn_state_chain",
          "trace_kind": "websocket_trace",
          "data_keys": [
            "received_sha256",
            "return_channel",
            "returned_sha256"
          ],
          "required_source_kinds": [
            "relay_binary"
          ]
        },
        {
          "fact_id": "a09.turn-state-compact",
          "scenario_id": "A09",
          "record_type": "turn_state_chain",
          "trace_kind": "process_trace",
          "data_keys": [
            "received_sha256",
            "return_channel",
            "returned_sha256"
          ],
          "required_source_kinds": [
            "relay_binary"
          ]
        }
      ]
    },
    {
      "package": "github.com/Wei-Shaw/sub2api/internal/service",
      "name": "TestCandidateTraceCodex0145WSCompressionAndDefaultTransport",
      "test_file": "backend/internal/service/official_egress_codex_candidate_trace_acceptance_test.go",
      "test_file_sha256": "9a155f84634652927c879eac53b0abf6919d515a48653125410daa43e9e323eb",
      "source_files": [
        {
          "path": "backend/internal/service/openai_ws_client.go",
          "sha256": "65a9cb0580dd715e9d49b1680318d3224e92143ffcf7dbb7bcfaad521de4be85"
        }
      ],
      "facts": [
        {
          "fact_id": "a05.ws-compression-context",
          "scenario_id": "A05",
          "record_type": "websocket_compression_context",
          "trace_kind": "websocket_trace",
          "data_keys": [
            "decompression_results"
          ],
          "required_source_kinds": [
            "relay_binary"
          ]
        },
        {
          "fact_id": "a05.default-websocket",
          "scenario_id": "A05",
          "record_type": "transport_fallback",
          "trace_kind": "websocket_trace",
          "data_keys": [
            "transports"
          ],
          "required_source_kinds": [
            "relay_binary"
          ]
        }
      ]
    },
    {
      "package": "github.com/Wei-Shaw/sub2api/internal/service",
      "name": "TestCandidateTraceCodex0145OAuthFallbackSameInvocation",
      "test_file": "backend/internal/service/official_egress_codex_candidate_trace_acceptance_test.go",
      "test_file_sha256": "9a155f84634652927c879eac53b0abf6919d515a48653125410daa43e9e323eb",
      "source_files": [
        {
          "path": "backend/internal/service/openai_gateway_forward.go",
          "sha256": "8baab9fe6785599eb3a89677bd8d401c2901566adf98fce5f99b994d909a515b"
        },
        {
          "path": "backend/internal/service/official_egress_integration.go",
          "sha256": "6564cec1ac6713c9e48a1fa28d795148943dfdfab82dbfac7c9f32174665e315"
        }
      ],
      "facts": [
        {
          "fact_id": "a07.oauth-fallback",
          "scenario_id": "A07",
          "record_type": "transport_fallback",
          "trace_kind": "process_trace",
          "data_keys": [
            "invocation_ids",
            "retry_budget_state",